{
  "version": 1,
  "evidence_policy": "typed-v1",
  "routing_policy": "progress-bounded-v2",
  "created_at": "",
  "updated_at": "",
  "title": "",
  "mode": "audited",
  "artifact_dir": "",
  "trace_path": "trace.jsonl",
  "tdd_trace_path": "tdd_trace.jsonl",
  "continuation": {
    "protocol": "handoff-v1",
    "status": "unclaimed",
    "owner": {
      "actor_id": "",
      "runtime": "",
      "epoch": 0,
      "claimed_at": ""
    },
    "previous_owner": {},
    "takeover_count": 0,
    "checkpoint": {
      "id": "",
      "sequence": 0,
      "checkpointed_at": "",
      "actor_id": "",
      "runtime": "",
      "reason": "run initialized",
      "current_task": "",
      "next_action": "Inspect task_spec.md and define the next ready task",
      "pending_verification": [],
      "repository": {
        "root": "",
        "cwd": "",
        "branch": "",
        "head": "",
        "dirty_paths": [],
        "dirty_entries": {},
        "worktree_digest": ""
      }
    },
    "last_resume": {
      "resumed_at": "",
      "actor_id": "",
      "runtime": "",
      "takeover_reason": "",
      "forced": false
    }
  },
  "state_witness": {
    "required": false,
    "path": "",
    "required_tier": "policy",
    "observed_tier": "",
    "review_status": "not_required",
    "reviewer_id": "",
    "review_evidence": [],
    "sealed_digest": "",
    "reviewed_at": ""
  },
  "tdd_current_cycle_context": {
    "task_id": "",
    "gate_mode": "",
    "phase": "",
    "command": "",
    "result": "",
    "exit_code": null,
    "trace_path": "tdd_trace.jsonl",
    "stdout_tail": "",
    "stderr_tail": "",
    "retry_count": 0,
    "max_retries": 3,
    "updated_at": ""
  },
  "status": "intake",
  "current_stage": "0",
  "synthesis": {
    "status": "not_started",
    "fuzzy_goal": false,
    "alignment_packet_path": "",
    "checklist": {
      "rewritten_goal": false,
      "fake_success_list": false,
      "constraints_nongoals": false,
      "pass_algorithms": false,
      "risk_ordered_phases": false,
      "first_ready_task": false,
      "stop_conditions": false
    },
    "recommended_defaults": [],
    "open_questions": []
  },
  "state_layers": {
    "working_state": {
      "current_stage": "0",
      "current_task": "",
      "active_blockers": [],
      "volatile_notes": [],
      "updated_at": ""
    },
    "session_state": {
      "shared_decisions": [],
      "shared_assumptions": [],
      "artifact_paths": {
        "task_spec": "task_spec.md",
        "progress": "progress.md",
        "acceptance_registry": "acceptance_registry.json",
        "trace": "trace.jsonl",
        "tdd_trace": "tdd_trace.jsonl",
        "lessons": "lessons.jsonl"
      },
      "delegation_state": [],
      "document_priority": [
        "task_spec.md",
        "acceptance_registry.json",
        "run_state.json",
        "tasks/*",
        "review prose"
      ]
    },
    "execution_log": {
      "trace_path": "trace.jsonl",
      "tdd_trace_path": "tdd_trace.jsonl",
      "append_only": true
    },
    "memory_boundary": {
      "policy": "Do not write cross-task memory into run artifacts by default.",
      "memory_candidates": [],
      "promotion_required": "user_approval_or_project_doc_update"
    }
  },
  "stages": [
    {
      "id": "0",
      "name": "spec-synthesis-or-measurement",
      "status": "planned",
      "tasks": [],
      "budget": "",
      "evidence": [],
      "stop_reason": ""
    }
  ],
  "tasks": [],
  "task_shape": {
    "id": "0.1",
    "name": "",
    "stage": 0,
    "status": "planned",
    "owner": "",
    "allowed_scope": [],
    "task_path": "tasks/0.1-example.md",
    "report_path": "reports/0.1-example.md",
    "dependencies": [],
    "expected_outputs": [],
    "verification": [],
    "verification_gate": {
      "mode": "not_applicable",
      "tdd_trace_path": "tdd_trace.jsonl",
      "red_command": "",
      "red_result": "",
      "red_failure_reason": "",
      "green_command": "",
      "green_result": "",
      "refactor_check": "",
      "substitute_check": "",
      "no_test_reason": ""
    },
    "retry_count": 0,
    "budget": "",
    "evidence": [],
    "stop_reason": ""
  },
  "generated_files": [],
  "stop_reason": ""
}
